{
  "tool": "/home/moonlight/.openclaw/workspace/tools/memory-risk-alerts",
  "timestamp": "2026-03-04T03:34:50.609328",
  "mode": "local",
  "transport": "local",
  "status": "healthy",
  "checks": [
    {
      "name": "config",
      "status": "pass",
      "message": "Configuration check"
    },
    {
      "name": "port",
      "status": "pass",
      "message": "Auto-assigned port: 35545",
      "details": {
        "chosen_port": 35545,
        "mode": "auto"
      }
    },
    {
      "name": "health",
      "status": "pass",
      "message": "Health check passed (local)",
      "details": {
        "output": "{\"status\": \"healthy\", \"version\": \"1.2.8\", \"checks\": {\"events_log_readable\": true, \"metrics_history_readable\": true}}\n"
      }
    },
    {
      "name": "sample_call",
      "status": "pass",
      "message": "Sample call passed (local)",
      "details": {
        "payload": {
          "action": "ping"
        },
        "output": "{\"status\": \"ok\", \"sample_result\": {\"ts\": \"2026-03-04T03:34:50.685008Z\", \"alerts\": [{\"level\": \"INFO\", \"metric\": \"sample_size\", \"message\": \"\\u6837\\u672c\\u91cf\\u4e0d\\u8db3 (events=27, sessions=0)\\uff0c\\u"
      }
    }
  ],
  "summary": {
    "passed": 4,
    "failed": 0,
    "warnings": 0
  },
  "chosen_port": 35545,
  "health_ok": true,
  "sample_call_ok": true
}