{
  "tool": "/home/moonlight/.openclaw/workspace/tools/memory-dashboard",
  "timestamp": "2026-03-04T03:34:50.316679",
  "mode": "local",
  "transport": "local",
  "status": "healthy",
  "checks": [
    {
      "name": "config",
      "status": "pass",
      "message": "Configuration check"
    },
    {
      "name": "port",
      "status": "pass",
      "message": "Auto-assigned port: 60523",
      "details": {
        "chosen_port": 60523,
        "mode": "auto"
      }
    },
    {
      "name": "health",
      "status": "pass",
      "message": "Health check passed (local)",
      "details": {
        "output": "{\"status\": \"healthy\", \"version\": \"1.2.8\", \"checks\": {\"events_log_readable\": true, \"metrics_dir_writable\": true}}\n"
      }
    },
    {
      "name": "sample_call",
      "status": "pass",
      "message": "Sample call passed (local)",
      "details": {
        "payload": {
          "action": "ping"
        },
        "output": "{\"status\": \"ok\", \"sample_result\": {\"ts\": \"2026-03-04T03:34:50.391667Z\", \"config_hash\": \"ac075ff6\", \"use_attribution\": 1.0, \"adoption_rate_any\": 0.1818, \"uses_per_recall\": 0.18, \"uses_per_recall_p50\": "
      }
    }
  ],
  "summary": {
    "passed": 4,
    "failed": 0,
    "warnings": 0
  },
  "chosen_port": 60523,
  "health_ok": true,
  "sample_call_ok": true
}